Wikipedia_ID,Movie_Name,Release_Date,Box_Office_Revenue,Runtime,Languages,Countries,Genres,Continents,Year,Rated,Director,Writer,Actors,Plot,Awards,Poster,Ratings,Metascore,imdbRating,imdbVotes,imdbID,DVD,Production,Website,Response,totalSeasons,Oscar,Nomination_Awards,Win_Awards,Internet_Movie_Database_Rating,Rotten_Tomatoes_Rating,Metacritic_Rating,Comedy_Types
213401,No Man's Land,2001-12-07,1012153.0,98.0,"['French Language', 'Bosnian language', 'English Language', 'Serbian language', 'Serbo-Croatian', 'German Language']","['Belgium', 'Bosnia and Herzegovina', 'Slovenia', 'France', 'Italy', 'United Kingdom']","['World cinema', 'Action/Adventure', 'Satire', 'Drama', 'Comedy', 'War film']",Europe,2001,16+,Danis Tanovic,Danis Tanovic,"Branko Djuric, Rene Bitorajac, Filip Sovagovic","Bosnia and Herzegovina during 1993 at the time of the heaviest fighting between the two warring sides. Two soldiers from opposing sides in the conflict, Nino and Ciki, become trapped in no man's land, whilst a third soldier become...",Won 1 Oscar. 30 wins & 25 nominations total,https://m.media-amazon.com/images/M/MV5BNTY3MzY5OWQtOWE1NC00OTVmLWExZDctNzEyMjhiYTJlZTMzXkEyXkFqcGc@._V1_SX300.jpg,"[{'Source': 'Internet Movie Database', 'Value': '7.9/10'}, {'Source': 'Rotten Tomatoes', 'Value': '93%'}, {'Source': 'Metacritic', 'Value': '84/100'}]",84.0,7.9,"49,235",tt0283509,,,,True,,1,25,30,7.9,9.3,8.4,Comedy_War
10286355,Primary Colors,1998-03-20,52090187.0,120.0,['English Language'],"['United States of America', 'France', 'Japan', 'United Kingdom', 'Germany']","['Media Satire', 'Japanese Movies', 'Film à clef', 'Comedy-drama', 'Political satire', 'Drama', 'Comedy', 'Film adaptation', 'Political cinema', 'Political drama']",Both,1998,16+,Mike Nichols,"Joe Klein, Elaine May","John Travolta, Emma Thompson, Kathy Bates",A man joins the political campaign of a smooth-operator candidate for President of the United States of America.,Nominated for 2 Oscars. 10 wins & 31 nominations total,https://m.media-amazon.com/images/M/MV5BYzlkNDFmM2UtYWY4ZC00NGQwLTgwNmYtMWMxMzNhZjM4ODk4XkEyXkFqcGc@._V1_SX300.jpg,"[{'Source': 'Internet Movie Database', 'Value': '6.7/10'}, {'Source': 'Rotten Tomatoes', 'Value': '80%'}, {'Source': 'Metacritic', 'Value': '70/100'}]",70.0,6.7,"30,400",tt0119942,,,,True,,0,31,10,6.7,8.0,7.0,Comedy_Political
590234,This Is the Army,1943,20831178.0,125.0,['English Language'],['United States of America'],"['Romance Film', 'Musical', 'War film', 'Comedy', 'Musical comedy']",America,1943,All Audiences (TP),Michael Curtiz,"Casey Robinson, Claude Binyon, Irving Berlin","George Murphy, Joan Leslie, George Tobias",A soldier wounded in the War (WWI) becomes a producer and stages a show for the forces.,Won 1 Oscar. 2 wins & 2 nominations total,https://m.media-amazon.com/images/M/MV5BNDhjNDFiZDctOTlkNS00NWRiLWJhMWEtOTkwYTNmNmJlYjJhXkEyXkFqcGc@._V1_SX300.jpg,"[{'Source': 'Internet Movie Database', 'Value': '5.8/10'}]",,5.8,"1,371",tt0036430,,,,True,,1,2,2,5.8,,,Comedy_War
2617281,Bat Thumb,2001,,28.0,['English Language'],['United States of America'],"['Parody', 'Action/Adventure', 'Superhero movie', 'Short Film', 'Comedy', 'Fantasy Comedy']",America,2001,Not Rated,David Bourla,Steve Oedekerk,"Steve Oedekerk, Paul Greenberg, Rob Paulsen","The Bat Thumb must stop another villian from taking over his precious city, only this time he will have to stop No Face in the hardest battle to date.",,https://m.media-amazon.com/images/M/MV5BMTY3ODc3MjMzM15BMl5BanBnXkFtZTcwMjIwNzIyMQ@@._V1_SX300.jpg,"[{'Source': 'Internet Movie Database', 'Value': '6.6/10'}]",,6.6,"1,090",tt0331189,,,,True,,0,0,0,6.6,,,Comedy_Superhero
10386612,The Third Generation,1979-05-13,,130.0,['German Language'],"['West Germany', 'Germany']","['Crime Fiction', 'Drama', 'Political drama', 'World cinema', 'Comedy']",Europe,1979,Not Rated,Rainer Werner Fassbinder,Rainer Werner Fassbinder,"Eddie Constantine, Hanna Schygulla, Volker Spengler","A wildly anarchic satire of urban guerrilla warfare in which a band of leftist radicals inadvertently become puppets of the West German government, which uses them to justify its authoritarian policies.",1 nomination,https://m.media-amazon.com/images/M/MV5BZTY0ODE5ZWEtNmYwMy00Y2Y5LWI0NjgtY2EyZGI0MWYyMjllXkEyXkFqcGdeQXVyMTY5Nzc4MDY@._V1_SX300.jpg,"[{'Source': 'Internet Movie Database', 'Value': '6.8/10'}, {'Source': 'Rotten Tomatoes', 'Value': '92%'}]",,6.8,"2,870",tt0079083,,,,True,,0,1,0,6.8,9.2,,Comedy_Political
232795,"South Park: Bigger, Longer & Uncut",1999-06-30,83137603.0,81.0,['English Language'],['United States of America'],"['Parody', 'Gross-out film', 'Absurdism', 'Animated Musical', 'Political satire', 'Animation', 'Musical', 'Satire', 'Comedy', 'Gross out', 'Political cinema', 'Black comedy', 'Musical comedy', 'War film']",America,1999,16+,Trey Parker,"Trey Parker, Matt Stone, Pam Brady","Trey Parker, Matt Stone, Mary Kay Bergman","When Stan Marsh and his friends go see an R-rated movie, they start cursing and their parents think that Canada is to blame.",Nominated for 1 Oscar. 7 wins & 11 nominations total,https://m.media-amazon.com/images/M/MV5BMDcyNDE4OWEtMjIzNi00OTdmLWIwMWEtNWU2ZjM4ZjA4YzNkXkEyXkFqcGc@._V1_SX300.jpg,"[{'Source': 'Internet Movie Database', 'Value': '7.7/10'}, {'Source': 'Rotten Tomatoes', 'Value': '81%'}, {'Source': 'Metacritic', 'Value': '73/100'}]",73.0,7.7,"217,429",tt0158983,,,,True,,0,11,7,7.7,8.1,7.3,Comedy_Political
232795,"South Park: Bigger, Longer & Uncut",1999-06-30,83137603.0,81.0,['English Language'],['United States of America'],"['Parody', 'Gross-out film', 'Absurdism', 'Animated Musical', 'Political satire', 'Animation', 'Musical', 'Satire', 'Comedy', 'Gross out', 'Political cinema', 'Black comedy', 'Musical comedy', 'War film']",America,1999,16+,Trey Parker,"Trey Parker, Matt Stone, Pam Brady","Trey Parker, Matt Stone, Mary Kay Bergman","When Stan Marsh and his friends go see an R-rated movie, they start cursing and their parents think that Canada is to blame.",Nominated for 1 Oscar. 7 wins & 11 nominations total,https://m.media-amazon.com/images/M/MV5BMDcyNDE4OWEtMjIzNi00OTdmLWIwMWEtNWU2ZjM4ZjA4YzNkXkEyXkFqcGc@._V1_SX300.jpg,"[{'Source': 'Internet Movie Database', 'Value': '7.7/10'}, {'Source': 'Rotten Tomatoes', 'Value': '81%'}, {'Source': 'Metacritic', 'Value': '73/100'}]",73.0,7.7,"217,429",tt0158983,,,,True,,0,11,7,7.7,8.1,7.3,Comedy_War
6526227,Night-Wolf,2005,,86.0,['English Language'],['United Kingdom'],"['Mockumentary', 'Comedy', 'Superhero movie']",Europe,2005,Not Rated,Kristen Gibson,"Kristen Gibson, Dave Storey, David Storey","Somerled Mackay, Miranda Webb, Michael Lee-Gentle","Night-Wolf has been Cardinal City's protector for over a decade, but what does it take to put on the costume night after night and wage war on crime? How can you keep fighting when you've lost 38 kid sidekicks on various dangerous...",,,"[{'Source': 'Internet Movie Database', 'Value': '7.8/10'}]",,7.8,29,tt0839925,,,,True,,0,0,0,7.8,,,Comedy_Superhero
171068,The Madness of King George,1994-12-28,15238689.0,109.0,['English Language'],['United Kingdom'],"['Biography', 'Costume drama', 'Comedy of manners', 'Period piece', 'Drama', 'Comedy', 'Political cinema', 'Biographical film', 'Historical fiction', 'Political drama']",Europe,1994,Recommended Parental Agreement (AP),Nicholas Hytner,Alan Bennett,"Nigel Hawthorne, Helen Mirren, Rupert Graves","When King George III goes mad, his Lieutenants try to adjust the rules to run the country without his participation.",Won 1 Oscar. 16 wins & 19 nominations total,https://m.media-amazon.com/images/M/MV5BOWYyMDcyZDUtMzQ0ZC00ZDllLWI1MTMtZjM0M2I5N2JhNDgzXkEyXkFqcGc@._V1_SX300.jpg,"[{'Source': 'Internet Movie Database', 'Value': '7.2/10'}, {'Source': 'Rotten Tomatoes', 'Value': '94%'}, {'Source': 'Metacritic', 'Value': '89/100'}]",89.0,7.2,"18,715",tt0110428,,,,True,,1,19,16,7.2,9.4,8.9,Comedy_Political
27398309,Ciguli Miguli,1952,,104.0,['Serbian language'],"['Yugoslavia', 'Socialist Federal Republic of Yugoslavia']","['Political satire', 'Comedy']",Europe,1952,Not Rated,Branko Marjanovic,Joza Horvat,"Ljubomir Didic, August Cilic, Viktor Bek","Ivan Ivanovic, a party functionary, arrives in a provincial town as a temporary replacement for a cultural official. The newcomer is fanatically eager to reform the town's cultural life in accordance with socialist ideals. He abol...",,https://m.media-amazon.com/images/M/MV5BODNhNjVkN2ItY2Q2Zi00NDZjLTk4OWEtMTJiNzQwNzAzMDliXkEyXkFqcGdeQXVyMTYzNTE3NDA@._V1_SX300.jpg,"[{'Source': 'Internet Movie Database', 'Value': '7.1/10'}]",,7.1,81,tt0044499,,,,True,,0,0,0,7.1,,,Comedy_Political
2553513,Shoulder Arms,1918-10-20,,46.0,['English Language'],['United States of America'],"['Silent film', 'Indie', 'Black-and-white', 'Comedy', 'War film', 'Slapstick']",America,1918,Not Rated,Charles Chaplin,Charles Chaplin,"Charles Chaplin, Edna Purviance, Syd Chaplin",Charlie is a boot camp private who has a dream of being a hero who goes on a daring mission behind enemy lines.,,https://m.media-amazon.com/images/M/MV5BODQ0Mzc5NzczMF5BMl5BanBnXkFtZTgwODkzNzkxMjE@._V1_SX300.jpg,"[{'Source': 'Internet Movie Database', 'Value': '7.3/10'}]",,7.3,"7,546",tt0009611,,,,True,,0,0,0,7.3,,,Comedy_War
254991,Passport to Pimlico,1949,,81.0,['English Language'],"['United States of America', 'United Kingdom']","['Political cinema', 'Political satire', 'Comedy', 'Ealing Comedies']",Both,1949,All Audiences (TP),Henry Cornelius,T.E.B. Clarke,"Stanley Holloway, Betty Warren, Barbara Murray","Residents of a part of London declare independence after they discover an old treaty, which leads to the need for a ""Passport to Pimlico"".",Nominated for 1 Oscar. 2 nominations total,https://m.media-amazon.com/images/M/MV5BM2QxMzhkZTYtZTY4OC00NjMyLThlYjQtZDA2MjBkZjNjODFiXkEyXkFqcGc@._V1_SX300.jpg,"[{'Source': 'Internet Movie Database', 'Value': '7.1/10'}, {'Source': 'Rotten Tomatoes', 'Value': '95%'}]",,7.1,"5,436",tt0041737,,,,True,,0,2,0,7.1,9.5,,Comedy_Political
24817928,White House Madness,1975,,121.0,['English Language'],['United States of America'],"['Political cinema', 'Parody', 'Comedy']",America,1975,16+,Mark L. Lester,Milton Miron,"Steve Friedman, Dennis Fimple, Perry Cook","Nixon finds his administration crumbling around him, his allies turning against him, the courts beginning to hound him and an exorcist is even called in to drive the demons from his soul.",,https://m.media-amazon.com/images/M/MV5BMzgzNjAzMjctMGY5NC00NWM2LTg0MzMtMTliODExZTIyZmY4XkEyXkFqcGdeQXVyNzc5MjA3OA@@._V1_SX300.jpg,"[{'Source': 'Internet Movie Database', 'Value': '5.2/10'}]",,5.2,42,tt0073895,,,,True,,0,0,0,5.2,,,Comedy_Political
13064670,Little Wildcat,1922-11-12,,50.0,['English Language'],['United States of America'],"['Silent film', 'Indie', 'Black-and-white', 'Short Film', 'Drama', 'Comedy', 'War film', 'Romance Film']",America,1922,Not Rated,David Smith,"Bradley J. Smollen, Gene Wright","Alice Calhoun, Ramsey Wallace, Herbert Fortier","Robert Ware takes it upon himself to tame wild girl, Mag, to prove to his doubting friend Arnold, he can turn her into a graceful young lady. Later, when Arnold is in the war, he meets a pretty nurse who greatly impresses him. Bac...",,https://m.media-amazon.com/images/M/MV5BYTUzNzQzNzYtMmM1My00ZjI2LTkwMTctNzc1Yjk2M2NkNTg0XkEyXkFqcGdeQXVyMjA0MzYwMDY@._V1_SX300.jpg,"[{'Source': 'Internet Movie Database', 'Value': '4.8/10'}]",,4.8,5,tt0013324,,,,True,,0,0,0,4.8,,,Comedy_War
9538297,City of Joy,1992,14683921.0,134.0,['English Language'],"['France', 'United States of America', 'United Kingdom']","['Comedy', 'Drama', 'Political drama', 'Film adaptation']",Both,1992,Recommended Parental Agreement (AP),Roland Joffé,"Dominique Lapierre, Mark Medoff","Patrick Swayze, Pauline Collins, Om Puri","An American doctor, a British nurse, and an illiterate Indian farmer unite to transform a Calcutta ghetto in this uplifting, inspirational movie starring Patrick Swayze and Pauline Collins.",1 nomination,https://m.media-amazon.com/images/M/MV5BMDU5Nzc2YWMtNzY1Mi00NmUxLTlmZTMtN2NjZDY5MzU4ZWY4XkEyXkFqcGc@._V1_SX300.jpg,"[{'Source': 'Internet Movie Database', 'Value': '6.5/10'}, {'Source': 'Rotten Tomatoes', 'Value': '53%'}]",,6.5,"5,733",tt0103976,,,,True,,0,1,0,6.5,5.3,,Comedy_Political
8256015,You're in the Navy Now,1951-02-23,1600000.0,93.0,['English Language'],['United States of America'],"['Slapstick', 'Comedy', 'Black-and-white', 'War film']",America,1951,Not Rated,Henry Hathaway,"John W. Hazard, Richard Murphy","Gary Cooper, Jane Greer, Millard Mitchell","When a new commander is assigned to a submarine chaser with an experimental engine, he finds the entire crew has as little experience as he does.",1 nomination,https://m.media-amazon.com/images/M/MV5BOGZhYTVmZmItNDgzZS00MmI0LTlmMzYtMDhmMzMyMDQyMzJhXkEyXkFqcGc@._V1_SX300.jpg,"[{'Source': 'Internet Movie Database', 'Value': '6.3/10'}, {'Source': 'Rotten Tomatoes', 'Value': '100%'}]",,6.3,803,tt0044224,,,,True,,0,1,0,6.3,10.0,,Comedy_War
14344144,Divided We Fall,2000-03-16,1830938.0,120.0,"['Czech Language', 'German Language']",['Czech Republic'],"['Drama', 'Comedy', 'War film']",Europe,2000,Recommended Parental Agreement (AP),Jan Hrebejk,"Jan Hrebejk, Petr Jarchovský","Bolek Polívka, Csongor Kassai, Jaroslav Dusek","In German-occupied Protectorate of Bohemia and Moravia (Czechia), a childless couple agree to hide a Jewish friend at great personal risk of discovery and execution.",Nominated for 1 Oscar. 15 wins & 4 nominations total,https://m.media-amazon.com/images/M/MV5BZTJhMGI4OWUtZWQwMi00ZTQ0LTk0MjgtMjY0NzMzNGRkMjNkXkEyXkFqcGc@._V1_SX300.jpg,"[{'Source': 'Internet Movie Database', 'Value': '7.6/10'}, {'Source': 'Rotten Tomatoes', 'Value': '90%'}, {'Source': 'Metacritic', 'Value': '69/100'}]",69.0,7.6,"5,438",tt0234288,,,,True,,0,4,15,7.6,9.0,6.9,Comedy_War
21211197,Grasshoppers,1991,,9.0,"['Czech Language', 'Italian Language', 'English Language', 'Spanish Language']",['Italy'],"['Short Film', 'History', 'Animation', 'Comedy', 'War film']",Europe,2021,Not Rated,Brad Bischoff,Brad Bischoff,"Saleh Bakri, Iva Gocheva, Frank V. Ross",Star-crossed immigrant lovers roam their gated community drink-by-drink in search of the perfect house.,1 win,https://m.media-amazon.com/images/M/MV5BYzczYjAwNWYtOGM2Ni00MGZjLWE2YmYtMjkzNGE0YTUyMmI2XkEyXkFqcGdeQXVyNjM2MTk2Njg@._V1_SX300.jpg,[],,,38,tt12967750,,,,True,,0,0,1,,,,Comedy_War
92999,Wag the Dog,1997-12-17,64256513.0,97.0,"['Albanian language', 'English Language']",['United States of America'],"['Parody', 'Media Satire', 'Political satire', 'Drama', 'Comedy', 'Political cinema', 'Political drama']",America,1997,16+,Barry Levinson,"Larry Beinhart, Hilary Henkin, David Mamet","Dustin Hoffman, Robert De Niro, Anne Heche","Shortly before an election, a spin-doctor and a Hollywood producer join efforts to fabricate a war in order to cover up a Presidential sex scandal.",Nominated for 2 Oscars. 2 wins & 23 nominations total,https://m.media-amazon.com/images/M/MV5BNmEwNzk5ZTYtNGUzOC00ZThjLTk3NGYtMDQ5MzNiYzQ0ZTNkXkEyXkFqcGc@._V1_SX300.jpg,"[{'Source': 'Internet Movie Database', 'Value': '7.1/10'}, {'Source': 'Rotten Tomatoes', 'Value': '86%'}, {'Source': 'Metacritic', 'Value': '73/100'}]",73.0,7.1,"89,450",tt0120885,,,,True,,0,23,2,7.1,8.6,7.3,Comedy_Political
6521673,Live Free or Die,2006,13836.0,92.0,['English Language'],['United States of America'],"['Heist', 'Comedy', 'Political drama', 'Indie']",America,2006,16+,"Gregg Kavet, Andy Robin","Gregg Kavet, Andy Robin","Aaron Stanford, Paul Schneider, Judah Friedlander",Lackluster criminals look to pull a job in the Granite State.,2 wins,https://m.media-amazon.com/images/M/MV5BMTUyMzA0NDg1NF5BMl5BanBnXkFtZTcwNjgzMTM0MQ@@._V1_SX300.jpg,"[{'Source': 'Internet Movie Database', 'Value': '5.4/10'}, {'Source': 'Rotten Tomatoes', 'Value': '40%'}]",,5.4,"2,530",tt0432318,,,,True,,0,0,2,5.4,4.0,,Comedy_Political
23752302,The Yes Men,2003,255364.0,80.0,['English Language'],['United States of America'],"['Culture & Society', 'Biography', 'Comedy', 'Political cinema', 'Social issues', 'Documentary']",America,2003,16+,"Dan Ollman, Sarah Price, Chris Smith",,"Andreas Bichlbauer, Mike Bonanno, Andy Bichlbaum","Anti-corporate activists travel from conference to conference, impersonating member of the World Trade Organization.",1 win & 2 nominations,https://m.media-amazon.com/images/M/MV5BMTgxMjI2NzgxMl5BMl5BanBnXkFtZTcwMDIyMzk3NA@@._V1_SX300.jpg,"[{'Source': 'Internet Movie Database', 'Value': '6.8/10'}, {'Source': 'Rotten Tomatoes', 'Value': '85%'}, {'Source': 'Metacritic', 'Value': '68/100'}]",68.0,6.8,"6,185",tt0379593,,,,True,,0,2,1,6.8,8.5,6.8,Comedy_Political
1660909,Operation Dumbo Drop,1995-07-28,24670346.0,92.0,['English Language'],['United States of America'],"['Adventure', 'Family Film', 'Animal Picture', 'Comedy', 'War film']",America,1995,Recommended Parental Agreement (AP),Simon Wincer,"James Morris, Gene Quintano, Jim Kouf","Danny Glover, Ray Liotta, Denis Leary","To keep the loyalty of a village during the Vietnam war, a U.S. Army officer and his unit struggle to deliver it a live elephant.",,https://m.media-amazon.com/images/M/MV5BOTJjM2U4MGMtNThmNi00ODAzLWE1ZGEtMzkyOWFjMzE0YzNjXkEyXkFqcGc@._V1_SX300.jpg,"[{'Source': 'Internet Movie Database', 'Value': '5.2/10'}, {'Source': 'Rotten Tomatoes', 'Value': '25%'}, {'Source': 'Metacritic', 'Value': '48/100'}]",48.0,5.2,"9,849",tt0114048,,,,True,,0,0,0,5.2,2.5,4.8,Comedy_War
3547149,The Raspberry Reich,2004,31211.0,90.0,"['German Language', 'English Language']","['Canada', 'Germany']","['LGBT', 'Sex comedy', 'Art film', 'World cinema', 'Gay Themed', 'Experimental film', 'Gay pornography', 'Gay', 'Political satire', 'Gay Interest', 'Drama', 'Comedy', 'Pornographic movie', 'Political drama', 'Avant-garde']",Both,2004,Not Rated,Bruce La Bruce,Bruce La Bruce,"Susanne Sachße, Daniel Bätscher, Andreas Stich","A left-wing terrorist group, consisting of several homosexual men and a female leader, kidnaps the son of a wealthy industrialist.",2 wins,https://m.media-amazon.com/images/M/MV5BMTQzOTU4MTQyN15BMl5BanBnXkFtZTcwNDUyMzcyMQ@@._V1_SX300.jpg,"[{'Source': 'Internet Movie Database', 'Value': '5.1/10'}, {'Source': 'Rotten Tomatoes', 'Value': '56%'}, {'Source': 'Metacritic', 'Value': '45/100'}]",45.0,5.1,"1,741",tt0390418,,,,True,,0,0,2,5.1,5.6,4.5,Comedy_Political
6972775,A Stranger in Town,1943,,66.0,['English Language'],['United States of America'],"['Drama', 'Comedy-drama', 'Comedy', 'Black-and-white', 'Political drama']",America,1943,All Audiences (TP),Roy Rowland,"Isobel Lennart, William Kozlenko","Frank Morgan, Richard Carlson, Jean Rogers","In a small corrupt town, an honest crusading lawyer running for mayor gets unexpected help from a tourist who happens to be a Supreme Court judge.",,https://m.media-amazon.com/images/M/MV5BNGNkODEwNWItMmI3Yi00YzRlLWFkYzAtMzhkMzc1NjIyZGNlXkEyXkFqcGc@._V1_SX300.jpg,"[{'Source': 'Internet Movie Database', 'Value': '7.1/10'}]",,7.1,"1,089",tt0036395,,,,True,,0,0,0,7.1,,,Comedy_Political
2195842,Guarding Tess,1994-03-11,27058304.0,95.0,['English Language'],['United States of America'],"['Thriller', 'Political cinema', 'Comedy of manners', 'Comedy', 'Comedy Thriller']",America,1994,Recommended Parental Agreement (AP),Hugh Wilson,"Hugh Wilson, PJ Torokvei","Shirley MacLaine, Nicolas Cage, Austin Pendleton","A former U.S. First Lady wants a particular Secret Service agent to head her bodyguard detail, even though he can't stand her.",2 nominations,https://m.media-amazon.com/images/M/MV5BMjNkYTQyNTItYzFkMi00MzhjLWEwZjQtZmZkM2JhMWQ1NjEyXkEyXkFqcGc@._V1_SX300.jpg,"[{'Source': 'Internet Movie Database', 'Value': '6.2/10'}, {'Source': 'Rotten Tomatoes', 'Value': '57%'}, {'Source': 'Metacritic', 'Value': '46/100'}]",46.0,6.2,"19,812",tt0109951,,,,True,,0,2,0,6.2,5.7,4.6,Comedy_Political
2150615,Teenage Mutant Ninja Turtles II: The Secret of the Ooze,1991-03-22,78656813.0,88.0,['English Language'],"['United States of America', 'Hong Kong', 'Japan']","['Japanese Movies', 'Indie', 'Superhero movie', 'Action Comedy', 'Superhero', 'Action/Adventure', 'Martial Arts Film', 'Comedy', 'Family Film', 'Action', 'Chinese Movies']",America,1991,Recommended Parental Agreement (AP),Michael Pressman,"Kevin Eastman, Peter Laird, Todd W. Langen","Paige Turco, David Warner, Michelan Sisti",The Turtles discover their origins while they endeavour to save New York City from the evil Shredder and his Foot Clan.,2 wins & 1 nomination,https://m.media-amazon.com/images/M/MV5BYzQwYzlhMjctMTcxYS00N2NmLTg4YzYtNjJjZjNhZTA0MzFlXkEyXkFqcGc@._V1_SX300.jpg,"[{'Source': 'Internet Movie Database', 'Value': '6.0/10'}, {'Source': 'Rotten Tomatoes', 'Value': '36%'}, {'Source': 'Metacritic', 'Value': '45/100'}]",45.0,6.0,"61,843",tt0103060,,,,True,,0,1,2,6.0,3.6,4.5,Comedy_Superhero
6551171,Howard the Duck,1986-08-01,37962774.0,110.0,['English Language'],['United States of America'],"['Thriller', 'Action/Adventure', 'Science Fiction', 'Adventure', 'Superhero movie', 'Stop motion', 'Animation', 'Cult', 'Comedy', 'Romance Film', 'Action']",America,1986,Recommended Parental Agreement (AP),Willard Huyck,"Steve Gerber, Willard Huyck, Gloria Katz","Lea Thompson, Jeffrey Jones, Tim Robbins",A sarcastic humanoid duck is pulled from his homeworld to Earth where he must stop an alien invasion with the help of a nerdy scientist and a struggling female rock singer.,5 wins & 4 nominations,https://m.media-amazon.com/images/M/MV5BZTA4ZjJkZjQtNzMwMy00YjJjLTkwYzgtZDY0YmNhZjYzMGExXkEyXkFqcGc@._V1_SX300.jpg,"[{'Source': 'Internet Movie Database', 'Value': '4.7/10'}, {'Source': 'Rotten Tomatoes', 'Value': '13%'}, {'Source': 'Metacritic', 'Value': '28/100'}]",28.0,4.7,"51,853",tt0091225,,,,True,,0,4,5,4.7,1.3,2.8,Comedy_Superhero
27376549,The Trotsky,2010-05-05,,120.0,['English Language'],['Canada'],"['Parody', 'Indie', 'Political satire', 'Comedy', 'Political cinema', 'Teen']",America,2009,Not Rated,Jacob Tierney,Jacob Tierney,"Liane Balaban, Jay Baruchel, Taylor Baruchel",A Montreal high school student who believes he is the reincarnation of Lev Trotskiy starts a revolution against apathy among his fellow students.,9 wins & 8 nominations,https://m.media-amazon.com/images/M/MV5BMjExMDA4NzU3Nl5BMl5BanBnXkFtZTcwNzEyNzUyNA@@._V1_SX300.jpg,"[{'Source': 'Internet Movie Database', 'Value': '6.7/10'}, {'Source': 'Rotten Tomatoes', 'Value': '79%'}, {'Source': 'Metacritic', 'Value': '59/100'}]",59.0,6.7,"6,406",tt1295072,,,,True,,0,8,9,6.7,7.9,5.9,Comedy_Political
900231,Team America: World Police,2004-10-11,50907422.0,97.0,"['Klingon language', 'French Language', 'Arabic Language', 'Korean Language', 'English Language']","['United States of America', 'Germany']","['Parody', 'Cult', 'Adventure', 'Political satire', 'Supermarionation', 'Musical', 'Satire', 'Adventure Comedy', 'Comedy', 'Political cinema', 'Black comedy', 'Action']",Both,2004,16+,Trey Parker,"Trey Parker, Matt Stone, Pam Brady","Trey Parker, Matt Stone, Elle Russ","Popular Broadway actor Gary Johnston is recruited by the elite counter-terrorism organization Team America: World Police. As the world begins to crumble around him, he must battle with terrorists, celebrities and falling in love.",1 win & 11 nominations,https://m.media-amazon.com/images/M/MV5BMTM2Nzc4NjYxMV5BMl5BanBnXkFtZTcwNTM1MTcyMQ@@._V1_SX300.jpg,"[{'Source': 'Internet Movie Database', 'Value': '7.2/10'}, {'Source': 'Rotten Tomatoes', 'Value': '77%'}, {'Source': 'Metacritic', 'Value': '64/100'}]",64.0,7.2,"180,555",tt0372588,,,,True,,0,11,1,7.2,7.7,6.4,Comedy_Political
2807539,Buffalo Soldiers,2001,2300684.0,98.0,['English Language'],"['United Kingdom', 'Germany']","['Crime Fiction', 'Action/Adventure', 'Period piece', 'Drama', 'Comedy', 'War film', 'Political cinema', 'Black comedy', 'Action', 'Political drama']",Europe,2001,16+,Gregor Jordan,"Robert O'Connor, Gregor Jordan, Eric Weiss","Joaquin Phoenix, Anna Paquin, Ed Harris",A criminal subculture operates among U.S. soldiers stationed in West Germany just before the fall of the Berlin wall.,1 win & 6 nominations,https://m.media-amazon.com/images/M/MV5BYWM4Mjk2NjItNzdiNC00YjQ1LTg1MWEtYzcwZDFkOWRkMGI3XkEyXkFqcGc@._V1_SX300.jpg,"[{'Source': 'Internet Movie Database', 'Value': '6.7/10'}, {'Source': 'Rotten Tomatoes', 'Value': '73%'}, {'Source': 'Metacritic', 'Value': '56/100'}]",56.0,6.7,"25,734",tt0252299,,,,True,,0,6,1,6.7,7.3,5.6,Comedy_War
2807539,Buffalo Soldiers,2001,2300684.0,98.0,['English Language'],"['United Kingdom', 'Germany']","['Crime Fiction', 'Action/Adventure', 'Period piece', 'Drama', 'Comedy', 'War film', 'Political cinema', 'Black comedy', 'Action', 'Political drama']",Europe,2001,16+,Gregor Jordan,"Robert O'Connor, Gregor Jordan, Eric Weiss","Joaquin Phoenix, Anna Paquin, Ed Harris",A criminal subculture operates among U.S. soldiers stationed in West Germany just before the fall of the Berlin wall.,1 win & 6 nominations,https://m.media-amazon.com/images/M/MV5BYWM4Mjk2NjItNzdiNC00YjQ1LTg1MWEtYzcwZDFkOWRkMGI3XkEyXkFqcGc@._V1_SX300.jpg,"[{'Source': 'Internet Movie Database', 'Value': '6.7/10'}, {'Source': 'Rotten Tomatoes', 'Value': '73%'}, {'Source': 'Metacritic', 'Value': '56/100'}]",56.0,6.7,"25,734",tt0252299,,,,True,,0,6,1,6.7,7.3,5.6,Comedy_Political
